{
  "schema_version": 1,
  "kind": "visual-job",
  "id": "job-maya-front-v1",
  "name": "Maya Front Reference",
  "target": {
    "asset_id": "chr-maya"
  },
  "profile_version": 1,
  "request_revision": "sha256:request123",
  "input_reference_ids": [
    "ref-maya-identity"
  ],
  "output_roles": [
    "identity"
  ],
  "expected_output_count": 1
}
