{
  "schema_version": 1,
  "kind": "visual-job",
  "id": "job-courtyard-kit-v1",
  "name": "Courtyard module kit turnaround",
  "target": {"asset_id": "env-courtyard"},
  "profile_version": 1,
  "request_revision": "sha256:courtyard-kit-request-v1",
  "input_reference_ids": ["ref-courtyard-front"],
  "output_roles": ["identity", "construction", "silhouette", "construction"],
  "expected_output_count": 4
}
