{
  "schema_version": 1,
  "kind": "visual-job",
  "id": "job-courier-sprite-v1",
  "name": "Courier sprite views",
  "target": {
    "asset_id": "chr-courier"
  },
  "profile_version": 1,
  "request_revision": "sha256:courier-sprite-request-v1",
  "input_reference_ids": ["ref-courier-front"],
  "output_roles": ["identity", "construction", "silhouette"],
  "expected_output_count": 3
}
